Page title and screen class,Views
SymPy: Solving Math Equations in Python and Jupyter - CodeSolid.com,1375
How to Work With Google Sheets In Python and Pandas - CodeSolid.com,622
CodeSolid.com - Python Learning Community,397
Python Indexing and Slicing: Complete Tutorial With Hands-On Exercises - CodeSolid.com,308
Pip vs Pipenv: Which is better and which to learn first? - CodeSolid.com,275
How To Use Docker Python Images and Docker Compose With Python - CodeSolid.com,223
NumPy Examples — Practice Questions Make You an Expert,197
What Are pyc Files and __pycache__ folders In Python ? - CodeSolid.com,168
Installing Pyenv on a Mac (A Setup Guide With Usage Tips) - CodeSolid.com,158
Pandas Examples and Review Questions to Make You an Expert - CodeSolid.com,129
How To Profile Python Code - CodeSolid.com,120
Python String Examples: Tutorial and Practice Exercises - CodeSolid.com,117
Python Dataclass: Easily Automate Class Best Practices - CodeSolid.com,115
Python Dunder Methods: The Ugliest Awesome Sauce - CodeSolid.com,112
Python Lists for Beginners: A Complete Lesson With Exercises - CodeSolid.com,103
Python Classes Zero to Expert: A Tutorial with Exercises - CodeSolid.com,92
Random Python: Secrets and Random Values Made Easy - CodeSolid.com,79
Boolean Expressions in Python: Beginner to Expert - CodeSolid.com,75
Learn Python: Tutorials from Beginner to Expert - CodeSolid.com,66
Creating a Python Interactive Plot Using Matplotlib in Jupyter,56
Fast S3 Updates with Golang and Goroutines - CodeSolid.com,56
PyCharm vs. VS Code: Which Is Better and Why? - CodeSolid.com,56
"Python JSON: Easily Work With Dictionaries, Files, and Custom Objects - CodeSolid.com",56
NumPy Examples: Practice Questions Make You an Expert,52
How To Compare Python Dictionaries - CodeSolid.com,50
My Journey to Beautiful Documentation With JupyterBook - CodeSolid.com,48
Python With: Using and Writing Context Managers in Python - CodeSolid.com,47
Python Practice - CodeSolid.com,42
Python for AWS Lambda Functions: A Beginner’s Guide - CodeSolid.com,39
Getting Things Done With Dendron and VS Code — First Look - CodeSolid.com,36
How To Separate Source and Tests in Python - CodeSolid.com,35
Page not found – CodeSolid.com,35
The Python For Loop: Complete Tutorial and Practice Exercises - CodeSolid.com,34
"Getting Things Done with GitHub, Markdown, and Visual Studio Code - CodeSolid.com",29
Thonny: The Most Beginner Friendly Python IDE - CodeSolid.com,29
How to Use the Pandas Groupby Method?,27
Learn Basic Command Line Skills and Rock Your Workflow - CodeSolid.com,27
Python Function Arguments: The Complete Guide - CodeSolid.com,27
Python Shell Programming: Overview and Top Tools,25
Introducing Sage Math: Symbolic Math Software In Python - CodeSolid.com,24
Simple Vagrant Ansible Local Example - CodeSolid.com,23
Jupyter Notebook: A Complete Introduction - CodeSolid.com,21
Python Practice: More Python on Docker Project Ideas - CodeSolid.com,21
Python Package Example: Setuptools - CodeSolid.com,20
SciPy vs. SymPy for Symbolic Math: Let Us Never Speak of This Again - CodeSolid.com,20
How To Install Pip and Conda on the Same Machine - CodeSolid.com,18
Private: How to Use the Pandas Groupby Method? - CodeSolid.com,17
Python Dictionaries for Beginners: A Complete Lesson With Exercises - CodeSolid.com,17
Python Date and Time Functions: The Complete Tutorial - CodeSolid.com,15
Learning C++ and Python: The Perfect Duo for Success - CodeSolid.com,14
Pip vs. Conda: Two Top Tools for Managing Python Packages - CodeSolid.com,14
John Lockwood - CodeSolid.com,13
Python Operators: The Building Blocks of Successful Code - CodeSolid.com,13
How to Practice Python: Data Science and Pandas - CodeSolid.com,12
Jupyter Lite: Python in the Browser with Serverless Jupyter,12
"Teach Yourself Math: Resources, Techniques, and Approach",12
The Function In Python: Complete Tutorial And Best Practices - CodeSolid.com,12
Debugging Python in VS Code - CodeSolid.com,11
Is Python Slow? Separating the Myths from the Facts - CodeSolid.com,11
Jupyter Password: Easy Notebook and Lab Configuration,11
How To Practice Python - CodeSolid.com,10
Is PyPy a Faster Version of Python? - CodeSolid.com,10
Python Docker Examples: SageMath in a Container - CodeSolid.com,10
Python Format Strings: Beginner to Expert - CodeSolid.com,10
Find Files in Python: Complete Cookbook for Searching Files and Folders - CodeSolid.com,9
Python - CodeSolid.com,9
Python Generator Functions: The Complete Guide - CodeSolid.com,9
Learning Git: What To Know When You’re a Beginner - CodeSolid.com,8
Private: Python String Examples: Tutorial and Practice Exercises - CodeSolid.com,8
What Is a Python Package? - CodeSolid.com,8
Best Python Careers: New Research Reveals Top Fields - CodeSolid.com,7
Installing a Python and Git Development Environment on Windows - CodeSolid.com,7
Programming and Math: A Brief Translation Guide - CodeSolid.com,7
Python for Beginners - CodeSolid.com,7
Aizhamal Zhetigenova - CodeSolid.com,6
Private: Creating a Python Interactive Plot Using Matplotlib in Jupyter,6
CodeSolid.com - Python Learning Community - Page 2,5
Learn to Code - CodeSolid.com,5
Useful Collection Classes in Python You May Not Know - CodeSolid.com,5
Private: Creating a Python Interactive Plot - CodeSolid.com,4
Private: Creating a Python Interactive Plot in Jupyter - CodeSolid.com,4
The Middle Way of Software Development - CodeSolid.com,4
Debugging Python in VS Code: Tutorial and Walkthrough - CodeSolid.com,3
Golang - CodeSolid.com,3
Private: How to Use the Pandas Groupby Method - CodeSolid.com,3
Seaborn - CodeSolid.com,3
Using TestNG With Spring - CodeSolid.com,3
What Are Good Projects To Practice In Python? - CodeSolid.com,3
"Your First Programming Language Should be Python, Not JavaScript - CodeSolid.com",3
Aizhamal - CodeSolid.com,2
Building a Docker Golang Container - CodeSolid.com,2
CodeSolid.com - Python Learning Community - Page 7,2
CodeSolid.com - Python Learning Community - Page 8,2
CodeSolid.com - Python Learning Community - Page 9,2
GTD - CodeSolid.com,2
John Lockwood - CodeSolid.com - Page 2,2
"June, 2022 - CodeSolid.com",2
Numpy - CodeSolid.com,2
Pandas - CodeSolid.com,2
Private: Creating a Python Interactive Plot Using Matplotlib in Jupyter - CodeSolid.com,2
Private: Jupyter Password Authentication: Easy Notebook and Lab Configuration - CodeSolid.com,2
Python Practice - CodeSolid.com - Page 2,2
Sympy - CodeSolid.com,2
Vagrant - CodeSolid.com,2
Why Is Python Popular? - CodeSolid.com,2
- CodeSolid.com,1
09 - CodeSolid.com,1
A Coop Coding Bootcamp - CodeSolid.com,1
Blog - CodeSolid.com,1
CodeSolid.com - Python Learning Community - Page 3,1
CodeSolid.com - Python Learning Community - Page 4,1
CodeSolid.com - Python Learning Community - Page 5,1
CodeSolid.com - Python Learning Community - Page 6,1
Contact - CodeSolid.com,1
Exploring Python Objects with the dir and type functions - CodeSolid.com,1
"Installing a Python and Git Development Environment on Windows, Part 2 - CodeSolid.com",1
Is Julia Easy to Learn for Python Developers? - CodeSolid.com,1
Is Python Free? Yes! We List the Best Free Tools - CodeSolid.com,1
"January, 2022 - CodeSolid.com",1
John Lockwood - CodeSolid.com - Page 3,1
John Lockwood - CodeSolid.com - Page 4,1
Jupyter - CodeSolid.com,1
Jupyter Lab - CodeSolid.com,1
Math and Math Software - CodeSolid.com,1
NumPy - CodeSolid.com,1
Pip vs Pipenv: Cái nào tốt hơn và cái nào nên học trước? - CodeSolid.com,1
Private: How to Use the Pandas Groupby Method￼￼ - CodeSolid.com,1
Private: Jupyter Lite: Python in the Browser with Serverless Jupyter - CodeSolid.com,1
Private: SciPy vs. SymPy for Symbolic Math: Let Us Never Speak of This Again - CodeSolid.com,1
Python Generator Functions - CodeSolid.com,1
Python Lists - CodeSolid.com,1
Python Math and Science - CodeSolid.com,1
"Stop Being a Junior Developer. No, Seriously, Cut It Out. - CodeSolid.com",1
The Strange Zen of 100 Days of Python - CodeSolid.com,1
debugging - CodeSolid.com,1
tuples - CodeSolid.com,1